{
  "description": "heartbeat while the device clock is untrusted. The device is online and persisting; only calendar time is unknown.",
  "channel": "status",
  "status_form": "heartbeat",
  "topic": "iotkit/v1/edge-node/rpi1/status",
  "qos": 1,
  "retain": true,
  "payload": "{\"uptime_ms\":45000,\"unix_epoch_ms\":null,\"value\":\"online\"}",
  "consumer_note": "Clock drift cannot be measured from this heartbeat. Liveness is unaffected."
}
