{
  "description": "measurement while the device clock is untrusted (for example before NTP synchronization, or on a site without NTP). unix_epoch_ms is null; uptime_ms still gives exact intervals within the run.",
  "channel": "observation",
  "kind": "measurement",
  "topic": "iotkit/v1/edge-node/rpi1/observation/press-01-temperature/measurement",
  "qos": 1,
  "retain": true,
  "payload": "{\"series_id\":\"018f5f83-7a2b-7c61-a729-6af238f558e0\",\"sequence\":44,\"uptime_ms\":8125456,\"unix_epoch_ms\":null,\"value\":23.75}",
  "consumer_note": "Place it on the calendar with your own anchor: receipt time of a live message minus its uptime_ms, applied to every observation of the same run. Do not treat null as an error."
}
