{
  "description": "measurement: a calibrated numeric value at one point in time. The unit is not in the payload; it is pipeline configuration and consumer registration.",
  "channel": "observation",
  "kind": "measurement",
  "topic": "iotkit/v1/edge-node/rpi1/observation/press-01-temperature/measurement",
  "qos": 1,
  "retain": true,
  "payload": "{\"series_id\":\"018f5f83-7a2b-7c61-a729-6af238f558e0\",\"sequence\":42,\"timestamp\":1784190000123,\"value\":23.5}",
  "consumer_note": "Reflect the latest value. A missing sequence is a diagnostic of incomplete history, not an error."
}
